stop_id,name,degree,in_degree,out_degree,pagerank,betweenness
6741,65 Skyway Ave,2,1,1,0.00010244670309659854,0.00010261590812420247
6742,Bathurst St at Carscadden Dr,2,1,1,0.0001263331368355083,0.0075387649356173396
6743,Calvington Dr at Dalsby Rd,2,1,1,7.60823054905237e-05,0.00045512547851977883
6745,Kipling Ave at Olivewood Rd,2,1,1,0.00010577999342488813,5.316886431305827e-07
6746,470 Coronation Dr,2,1,1,8.83179517866541e-05,0.0014073798383666526
6748,160 Horner Ave - Toronto South Detention Centre,2,1,1,7.372903715262962e-05,0.0011703530412590386
6749,Gary Dr at Meadow Oak Pl West Side,2,1,1,9.283077363558186e-05,0.00010261590812420247
6750,1610 The Queensway,2,1,1,0.00011262628145023129,0.010339534756325484
6751,Avenue Rd at Glencairn Ave,2,1,1,0.00011062853171393727,0.0004104636324968099
6752,Sheppard Ave East at Shaughnessy Blvd,3,2,1,9.665345128582762e-05,0.015519321757893534
6753,Commander Blvd at North Wind Pl West Side,2,1,1,4.225474786262986e-05,0.002265436693605558
6754,Dawes Rd at Beth St,2,1,1,0.00010461100106974507,0.005991422089890826
6755,Dundas St West at Highway 427,2,1,1,0.00013052247662364777,0.01778986522126675
6756,Victoria Park Ave at Consumers Rd,4,2,2,0.00017921347132645788,0.011804957142986478
6757,Underhill Dr at Shawfield Cres (South),2,1,1,7.507603420831505e-05,0.04021823530259972
6758,Kennedy Rd at Ellesmere Rd,2,1,1,0.0002827846216606334,0.03275158694742475
6760,Midland Ave at Norbury Cres South Side,2,1,1,0.00011062853171393727,0.005495002126754573
6762,Bellamy Rd North at Lawrence Ave East,2,1,1,0.00010337791906895845,0.0008262441514249256
6763,Laurentide Dr at Silverdale Cres,2,1,1,6.898160078137148e-05,0.007875187356950437
6764,Driftwood Ave at Hoover Cres,2,1,1,0.00010002862671774985,0.0012313908974904296
6765,Kipling Ave at Bethridge Rd,2,1,1,0.00011339338135760223,0.0035743614597592665
6766,Markham Rd at Eastpark Blvd,2,1,1,0.000111833367667038,0.0
6767,St Clair Ave East at Westbourne Ave East Side,2,1,1,7.581487967402849e-05,0.00932390472139515
6768,St Clair Ave East at Kingston Rd West Side,4,2,2,0.00018334309665829466,0.01712152807316036
6769,Weston Rd at Fenmar Dr North Side,2,1,1,0.00010933299117341777,0.005417254056024792
6770,Lawson Rd at Highway 2A Overpass East Side,2,1,1,8.872927079202166e-05,0.0008209272649936198
6771,Wellesley St West at Yonge St,2,1,1,0.00010189746528107177,0.0032689547001276053
6773,Weston Rd at McCormack St,2,1,1,0.00015600789360514046,0.00020523181624840494
6775,Lawrence Ave East at Walkway to Ridgewood Rd,2,1,1,0.0001072412052864436,0.00010261590812420247
6776,Bloor St West at Dufferin St,2,1,1,0.00010019378648416948,0.012974578298797746
6777,Crescent Rd at South Dr (East),2,1,1,0.00011062853171393727,0.0
6778,O'Connor Dr at Dohme Ave,2,1,1,0.0001177218810581425,0.008795190234350476
6779,Leslie St at Nymark Ave,2,1,1,0.00010248830632979668,0.001517838153977031
6780,Martin Grove Rd at Sedgeley Dr,3,1,2,0.000175246946892523,0.0027706295193534666
6783,King St West at Niagara St,2,1,1,0.00014212228412027592,0.006639889517450717
6784,Danforth Rd at Neston Ave West Side,3,2,1,0.00011824238728748763,0.00292284818010573
6785,Steeles Ave West at Rossdean Dr,2,1,1,0.00011718709338697184,0.0020942595349496677
6786,Eglinton Ave East at McCowan Rd,2,1,1,0.0001720290700166082,5.316886431305827e-07
6787,Church St at Weston Rd East Side,2,1,1,2.7354163013735956e-05,0.00202364242166454
6789,Murison Blvd at Split Maple Crt South Side,2,1,1,9.466197312919933e-05,0.0011255848575074437
6790,Church St at Rosemount Ave,2,1,1,9.055465236778418e-05,0.00020523181624840494
6791,Kipling Ave at Princess Margaret Blvd,2,1,1,0.00011966408150551505,0.0003078477243726074
6792,Kipling Ave at North Queen St,2,1,1,0.00010029450185918196,3.1901318587834965e-06
6793,Jones Ave at Dundas St East,2,1,1,6.631019913257253e-05,0.001274058911101659
6794,Bathurst St at Neptune Dr,2,1,1,9.589210827267388e-05,0.0017343200185607672
6795,Clonmore Dr at Warden Ave West Side,2,1,1,5.972643832844875e-05,0.00690613222025387
6796,York Mills Rd at Chipstead Rd,4,2,2,0.00014098718742990775,0.139243600045012
6797,Lawrence Ave East at Ellington Dr,2,1,1,9.647226488073625e-05,0.0
6798,Eglinton Ave West at Black Creek Dr,5,2,3,0.00013459081611491452,0.06353489663616749
6799,Victoria Park Ave at Finch Ave East,4,2,2,0.00015371263565590613,0.007518399786623415
6800,Caledonia Rd at Raitherm Rd South Side,2,1,1,0.00011589571872699112,0.0035845662046637143
6801,Leslie St at Mosley St,2,1,1,9.063424072523114e-05,0.004190636962994471
6802,Queen St East at Greenwood Ave,2,1,1,0.00013122656503483142,0.006093417694598043
6803,Pharmacy Ave at Finch Ave East North Side,2,1,1,8.663525914155359e-05,0.0029758613356018716
6804,Kipling Ave at Bethridge Rd,2,1,1,0.00010987317854394395,0.004642702094523013
6805,Eglinton Ave East at Lebovic Ave,2,1,1,9.041008815214265e-05,0.016386485448480346
6806,Steeles Ave East at Woodbine Ave,4,2,2,0.00012610855035388437,0.012205896573633147
6807,Yonge St at Ranleigh Ave,2,1,1,0.000105917150177466,0.023831449749180725
6808,Finch Ave West at Silverstone Dr,2,1,1,9.823163871970785e-05,0.0010034559761803491
6809,Grandravine Dr at Driftwood Ave,2,1,1,9.0666295400171e-05,0.0010123351765206296
6810,Avenue Rd at Ridley Blvd,2,1,1,0.00011062853171393727,0.0020523181624840492
6811,College St at Havelock St,2,1,1,0.00011062853171393727,0.005241801477977573
6813,Finch Ave East at Pharmacy Ave,3,2,1,0.0001460397203929764,0.010018889943177478
6814,Kipling Ave at Rexdale Blvd,2,1,1,0.00011388614040513579,0.003676977367883469
6815,Sherbourne St at Queen St East,2,1,1,0.0001059805196161931,0.0031810931518502766
6816,Christie St at Essex St South Side,2,1,1,9.698168642372545e-05,0.010695448745214801
6817,Ellesmere Rd at Morrish Rd,2,1,1,8.573801614719596e-05,0.006083578922849447
6818,Linkwood Lane at St Dennis Dr,2,1,1,6.238470705630897e-05,0.0013781369629944705
6819,Brimley Rd at Walkway to Audrelane Crt,2,1,1,5.2894199131276036e-05,0.0
6820,Dawes Rd at Ferris Rd,2,1,1,0.00010550878019945087,0.005888806181766624
6821,Scarlett Rd at Lawrence Ave West South Side,2,1,1,5.510290403803247e-05,0.002611787537218205
6822,Gilley Rd at Garratt Blvd,2,1,1,8.925871008175589e-05,0.0033712604565433154
6824,McCowan Rd at James Parrot Ave,2,1,1,0.00011062853171393727,0.0034820289238621863
6825,Annette St at Indian Road Cres,2,1,1,9.826941039632736e-05,0.011007195519637036
6826,Milner Ave at Cinemart Dr,2,1,1,9.816727162281758e-05,0.0009203530412590388
6827,Ellesmere Rd at Zaph Ave,2,1,1,9.131983357694103e-05,0.005878347106601041
6828,Lawson Rd at Highway 2A Overpass,2,1,1,9.445693859077157e-05,0.002031936764497377
6829,Thistle Down Blvd at Barkwin Dr West Side,2,1,1,9.496870001738508e-05,0.00040886856656741815
6830,Grand Ave at Dalesford Rd South Side,2,1,1,6.063366951771151e-05,0.0009908611661683451
6831,Dundas St East at Church St,2,1,1,9.785279199897158e-05,0.005294347442103715
6832,Sheppard Ave East at Markham Rd,2,1,1,0.00013164009266210068,0.0
6833,Kipling Ave at Greensboro Dr,3,1,2,0.00010715516058763344,0.0019183357617083782
6834,Kipling Ave at Horner Ave,4,2,2,0.00010378213884016687,0.0
6835,Davenport Rd at Oakwood Ave,4,2,2,0.0002205571411154206,0.023744208805366582
6836,Yonge St at Balmoral Ave,2,1,1,9.663881886501607e-05,0.007048583569974244
6837,Bathurst St at Roselawn Ave,2,1,1,0.00011058409257457477,0.005823289164420598
6838,Birchmount Rd at Staley Ter,2,1,1,0.00011062853171393727,0.01321990642279881
6839,Whitehorse Rd at Rimrock Rd,2,1,1,0.00011062853171393727,0.0004104636324968099
6840,Humberwood Blvd at Pinecone Dr,2,1,1,0.00011541070797557615,0.008886218630370054
6843,The West Mall at Bloor St West,2,1,1,9.295936190983339e-05,0.001690100421113991
6845,Kipling Ave at Olivewood Rd,2,1,1,0.00010248505467271002,3.1901318587834965e-06
6846,Warden Ave at Eglinton Ave East,4,2,2,0.0001164117242368341,0.003789096838224869
6847,Runnymede Rd at Glenwood Ave North Side,2,1,1,0.0001386653066154784,0.0025653977031050617
6848,Sheppard Ave West at Bathurst St West Side,4,2,2,0.00015558068985259247,0.00922868080723424
6849,McNicoll Ave at McCowan Rd,2,1,1,0.00011062853171393727,0.0004952679710761379
6850,Woodbine Ave at O'Connor Dr South Side,2,1,1,0.00012117461594616266,0.004349081232109731
6851,Overlea Blvd at Don Mills Rd West Side,5,3,2,0.00026633684596846335,0.05099600186907624
6852,Birchmount Rd at 14th Ave South Side,2,1,1,0.00011062853171393727,0.0007183113568694173
6853,Royal York Rd at Dundas St West South Side,2,1,1,0.00017385933585979733,0.008700552956188856
6854,Markham Rd at Verne Cres North Side,2,1,1,0.00011277952516086689,0.0
6856,Birchmount Rd at Chelwood Rd,2,1,1,0.00011062853171393727,0.00977938465901035
6857,Triton Rd at Borough Dr,19,6,13,0.0005318112980403929,0.17216471051449597
6858,Royal York Rd at North Dr North Side,2,1,1,0.00010082667973789085,0.02167062613588028
6859,Spadina Rd at Kendal Ave,2,1,1,0.00011062853171393727,0.0061077877885619275
6860,Linkwood Lane at Windy Golfway (South),2,1,1,4.3857380839256036e-05,0.0015833687792428754
6861,Yonge St at Mcglashan Rd,2,1,1,0.00010119406621533265,0.0228052906679387
6862,Eglinton Ave West at Islington Ave,2,1,1,9.831122418297851e-05,0.0025478519778817524
6863,Opposite 3501 Finch Ave East - St Aidan,2,1,1,9.542898071141938e-05,0.00010261590812420247
6864,Spadina Rd at Old Forest Hill Rd,2,1,1,8.671776880528627e-05,0.002361905405295396
6865,Eglinton Ave West at Vesta Dr,3,2,1,0.00018970502192953816,0.03297824617118562
6866,Elmhurst Dr at Harefield Dr,2,1,1,0.00012588334540111193,0.00042545725223309234
6867,Ossington Ave at Queen St West North Side,2,1,1,0.00010982257907270107,0.007836037558746973
6868,Wilson Ave at Bathurst St West Side,5,3,2,0.00016717396520925536,0.13932875292676705
6869,Yonge St at Steeles Ave East,5,2,3,0.00010431694012790163,0.05479352690703796
6870,Kennedy Rd at Finch Ave East,2,1,1,0.0001020263648567961,0.0059703317737133145
6871,Martin Grove Rd at Milkwood Ave North Side,4,2,2,0.00016598358400657232,0.003136298383666525
6872,Dundas St West at Islington Ave East Side,2,1,1,7.650861389722711e-05,0.0019639370093963884
6873,The Queensway at North Queen St East Side,2,1,1,7.985313885283836e-05,0.005513967525993123
6874,2260 Markham Rd,2,1,1,0.0001694180122801582,0.00010261590812420247
6875,Brimley Rd at Grittani Lane,2,1,1,6.210686931833831e-05,0.001949702254359847
6876,Scarlett Rd at Tilden Cres,2,1,1,0.00010534047231551013,0.00033398908265986103
6877,Markham Rd at Luella St,2,1,1,0.00011043936111616292,0.0
6878,Dovercourt Rd at Davenport Rd,2,1,1,0.00010295792440042598,0.004180185259982342
6879,Thirtieth St at Alhena Ave,2,1,1,5.455843247720552e-05,0.001241847440805331
6880,Kipling Ave at North Queen St,2,1,1,0.000108202721858367,5.316886431305827e-07
6881,Huntingwood Dr at Kilkenny Dr,2,1,1,0.00011062853171393727,0.005054675315468595
6882,3900 Victoria Park Ave,2,1,1,0.00010308861763203998,0.0
6883,Danforth Rd at McDonald Ave West Side,2,1,1,9.086785035340879e-05,0.0024800278411507676
6884,Mt Pleasant Rd at Sherwood Ave,2,1,1,0.00011062853171393727,0.0003078477243726074
6885,Yonge St at Madawaska Ave,2,1,1,0.00018523652645245625,0.030028679651350018
6886,Markham Rd at Pandora Cir,2,1,1,0.00012764947975270672,0.0
6887,Albion Rd at Arcot Blvd North Side,2,1,1,5.2701737884159484e-05,0.005716716290940026
6888,Victoria Park Ave at Arncliffe Cres North Side,2,1,1,0.0001133813024844156,0.00030731603572947686
6889,New Westminster Dr at Centre St,2,1,1,9.39469622337966e-05,0.002150148872820077
6890,Oriole Pkwy at Kilbarry Rd,2,1,1,0.00011991560582633913,0.004876648234793705
6891,Steeles Ave West at Walkway to Friuli Crt,3,1,2,9.961132050034533e-05,0.008110131483473866
6892,Spadina Ave at Nassau St South Side,2,1,1,0.00011062853171393727,0.010084006805614632
6893,Grantbrook St at Charlton Blvd,2,1,1,0.00011062853171393727,0.001334006805614632
6894,Flemington Rd at Replin Rd,2,1,1,6.704628963328714e-05,0.0005130795406210123
6895,Belfield Rd at C.N. East Spur,2,1,1,7.371745803788412e-05,0.00141237554728811
6896,Gerrard St East at Pape Ave,3,1,2,0.00012369694535810597,0.0066883528441641985
6897,Yonge St at Dundas St East - Dundas Station,2,1,1,0.00011510542483141723,0.002169378278746633
6898,Laurentide Dr at Tetbury Cres,2,1,1,6.172810234366982e-05,0.007977803265074638
6899,Dupont St at Emerson Ave,2,1,1,0.00011062853171393727,0.01039150007089182
6900,Pearson Airport Terminal 3 (Arrivals Level Columns C8-C12),4,1,3,0.00015983110945794844,0.0254560110130877
6901,Steeles Ave East at Dumont St,5,3,2,0.00018072135263876802,0.003315344534240749
6903,Markham Rd at Bur Oak Ave - Mount Joy GO Station,2,1,1,0.00011062853171393727,0.0063589961718417696
6904,Dupont St at Dovercourt Rd,2,1,1,0.00011062853171393727,0.012442987981110059
6905,Dundas St West at Annette St,2,1,1,0.0001191634257190017,0.013073474527390036
6906,Leslie St at Nymark Ave,2,1,1,0.00011255027720086607,0.0017407486176095278
6907,Parkwoods Village Dr at Brookbanks Dr,4,2,2,0.0001459028807154013,0.10780687613691943
6909,Finch Ave West at Jayzel Dr,3,2,1,0.00018585635433247542,0.0058403028852970365
6910,Lansdowne Ave at Wallace Ave,2,1,1,0.00011062853171393727,0.006355806039982986
6911,Weston Rd at Fenmar Dr South Side,2,1,1,0.00011834724248013592,0.00018088047639302425
6913,Dundas St East at Jarvis St,2,1,1,0.00011062853171393727,0.00855185694368489
6914,The Westway at Sandwell Dr,2,1,1,0.00010027763785554964,0.006563510208421948
6915,Scarlett Rd at Lockheed Blvd,2,1,1,0.00010260823917149513,0.0
6916,Cummer Ave at Craigmont Dr,2,1,1,0.00011062853171393727,0.01060913795547994
6917,Royal York Rd at Evans Ave South Side,4,1,3,0.0001016443484335959,0.007743628909372211
6918,Steeles Ave West at Gaudaur Rd,2,1,1,9.782619355735907e-05,0.008315363299722272
6919,Evans Ave at Garroch Pl,2,1,1,6.105918427383978e-05,0.0055487992016490535
6920,Dixon Rd at St Phillips Rd,4,2,2,8.43299490703988e-05,0.010923829174865968
6921,Martin Grove Rd at Waterbury Dr,2,1,1,0.00010484314128326072,0.011941913015737984
6922,Humberline Dr at Claireville Dr (North),2,1,1,9.340676399643456e-05,0.001128774989366227
6923,Lawrence Ave West at Ledbury St,2,1,1,0.00010732636087138999,0.00010261590812420247
6924,Bathurst St at Barton Ave,3,2,1,0.00011264554863879743,0.0031915896815395877
6925,Queen St East at Silver Birch Ave,2,1,1,3.070777245783657e-05,0.0
6926,Bombay Loop at Avenue Rd,2,1,1,0.00011062853171393727,0.0018470863462356445
6928,Birchmount Rd at Ashtonbee Rd,2,1,1,0.00011062853171393727,0.010087232383382957
6929,Evans Ave at Islington Ave,2,1,1,7.482122542021588e-05,0.005343567385400649
6931,Brimorton Dr at Mid Pines Rd,2,1,1,8.495946202941821e-05,0.0050625998930178
6932,Dufferin St at Davenport Rd North Side,4,2,2,0.000128661924051923,0.0240333179487518
6933,Prince Edward Dr South at Bloor St West,2,1,1,0.00013622405929149454,0.027793159571535796
6934,College St at University Ave (Queen's Park Station,2,1,1,0.00011062853171393727,0.009078359934644495
6935,Don Mills Rd at Premier Davis Blvd - Seneca College,2,1,1,9.112262152045466e-05,0.0
6936,Jane St at Lawrence Ave West,4,2,2,0.00016692918903831564,0.025359330713288837
6937,Midland Ave at Emblem Crt,2,1,1,0.00011062853171393727,0.0017822203317737133
6938,Danforth Ave at Carlaw Ave,2,1,1,0.00011062853171393727,0.010511796503816884
6939,Foxwell St at Duern St,2,1,1,7.633910237575478e-05,0.00020523181624840494
6940,Glencairn Ave at Shermount Ave,2,1,1,8.501561629917003e-05,0.004048208651568924
6941,Sentinel Rd at Grandravine Dr,3,1,2,9.700138387079072e-05,0.0025024056875473915
6942,Martin Grove Rd at Cabernet Cir,2,1,1,0.00013986167794554678,0.0014121473132000567
6943,120 Norfinch Dr,2,1,1,7.618283236697485e-05,0.0009347399104261014
6944,Laird Dr at Esandar Dr North Side,2,1,1,9.232337366940171e-05,0.006129629143718895
6945,Steeles Ave West at Pine Valley Dr,2,1,1,0.00010401582645430541,0.00821274739159807
6946,Dundas St West at West Mall Cres East Side,2,1,1,0.0001340352290010865,0.017892481129390955
6947,Finch Ave East at Longmore St,2,1,1,0.00010176274584185654,0.0
6948,Greenwin Village Rd at Bathurst St,2,1,1,0.00010842131614540536,0.00403600015467306
6949,Bloor St West at Ossington Ave,2,1,1,0.00011062853171393727,0.009306715353703865
6950,Dundas St West at Shaver Ave South,2,1,1,9.29176443744666e-05,0.004819225861335604
6951,1235 Ormont Dr,2,1,1,0.00010480231302850587,0.0003459698000850702
6952,Jane St at Clair Rd,2,1,1,0.00015348143521217355,0.0
6953,Greenwood Ave at Dorothy St,2,1,1,0.00011062853171393727,0.0003817524457677584
6954,The Westway at Brampton Rd West Side,2,1,1,9.832537834730175e-05,0.006666126116546151
6955,Kennedy Rd at McNicoll Ave,2,1,1,9.561808973860894e-05,0.0018470863462356445
6956,Danforth Ave at Playter Blvd,2,1,1,0.00010742059298198383,0.01125641760806371
6957,Weston Rd at Starview Lane,4,2,2,0.00011645685144744992,0.011563550085070184
6958,Birchmount Rd at Rolark Dr,2,1,1,0.00011093810085101736,0.006887530129023111
6959,Valley Woods Rd at Brookbanks Dr,2,1,1,4.9312511209483495e-05,0.02276216661369256
6960,Finch Ave East at Kennedy Rd,4,2,2,0.0001474637637962008,0.014824211882935498
6961,Spadina Rd at Lowther Ave,2,1,1,0.00011062853171393727,0.00621040369668613
6962,Victoria Park Ave at Paget Rd North Side,2,1,1,0.0001064490618310475,0.0
6963,Uphill Ave at Woodward Ave,2,1,1,9.343753294413525e-05,0.0005284630653622572
6964,O'Connor Dr at Amsterdam Ave,2,1,1,9.496378681318667e-05,0.007685782498557777
6965,Pape Ave at Fulton Ave South Side,2,1,1,9.309000514809012e-05,0.017247384893333422
6966,Washburn Way at Nahanni Ter,2,1,1,8.17251022694692e-05,0.002888345320023329
6967,Bingham Loop,4,2,2,0.00012507769446897486,0.0005107553016953272
6968,Brimley Rd at Waterfield Dr,2,1,1,7.524011788758648e-05,0.0013156846461823068
6969,Rathburn Rd at Birchcroft Rd,2,1,1,0.0001062942850847642,0.0005598681412165036
6970,Gerrard St East at Sackville St,2,1,1,0.00011062853171393727,0.008052200853402471
6971,St Clair Ave West at Wychwood Ave,2,1,1,5.933692568876845e-05,0.002038494257762654
6972,Avenue Rd at Heath St West,2,1,1,0.00012572662967578617,0.00044832841365483305
6973,Grandravine Dr at Keele St,2,1,1,5.3273186420477e-05,0.000299109164254058
6974,Ellesmere Rd at Gander Dr East Side,2,1,1,0.0001642026756134328,0.02057940360185682
6975,Weston Rd at Imogene Ave,2,1,1,8.720010112864932e-05,0.00020523181624840494
6976,Humberline Dr at Holyoake Cres (East) West Side,2,1,1,0.00018485690510931986,0.011451616333475115
6977,Wilmington Ave at Combe Ave,2,1,1,6.578214493693327e-05,0.0030859208847299024
6978,Starspray Loop at Lawrence Ave East,2,1,1,0.00010678119201789864,0.00020523181624840494
6979,7675 Markham Rd,2,1,1,7.632470934643188e-05,0.004185452998723947
6980,Moore Ave at Lumley Ave,2,1,1,9.469789566494131e-05,0.003883707034493934
6983,Parliament St at Richmond St East,2,1,1,0.00010287194735527464,0.0011074314881205564
6984,Welland Ave at St Clair Ave East,2,1,1,9.877468797051006e-05,0.0035758593101213264
6985,Davisville Ave at Belle Ayre Blvd,2,1,1,0.00015092212943679866,0.00811051761934365
6987,Keele St at Ypres Rd,2,1,1,0.00010469517179865004,0.0
6988,Kipling Ave at Kidron Valley Dr,2,1,1,4.398092704350596e-05,0.002361448112455934
6989,Burnhamthorpe Rd at Burnhamthorpe Cres,2,1,1,0.00011062853171393727,0.004737877498936623
6990,Horner Ave at Fima Cres,2,1,1,9.167142871132727e-05,0.0007598894087622288
6991,Rathburn Rd at Elmcrest Rd,2,1,1,0.0001045509549984266,0.0013276265418970651
6993,Wilson Ave at Walsh Ave,2,1,1,0.00010655171580192327,0.0
6994,Coxwell Ave at O'Connor Dr South Side,2,1,1,0.00010528298134710324,0.0032281475967673333
6995,Wynford Dr at Garamond Crt,2,1,1,0.00010087277780115828,0.00020523181624840494
6996,Islington Ave at St Georges Blvd,2,1,1,0.00011398807379756903,0.0
6998,Jane St at Rita Dr North Side,2,1,1,0.00010724109445177398,0.00010261590812420247
6999,Brimley Rd at Applefield Dr (South),2,1,1,7.984675085892818e-05,0.0012130687380581043
7000,Weston Rd at Dora Spencer Rd,2,1,1,0.00010006967078662993,0.0
7001,Lawrence Ave West at Sage Ave,2,1,1,0.00017485026447378304,0.00020523181624840494
7002,Kingston Rd at Dundas St East,2,1,1,0.00011298997932162157,0.0004588472990216929
7003,McNicoll Ave at Pharmacy Ave,2,1,1,0.00010923842493009076,0.0026704948248972064
7004,McNicoll Ave at Bramblebrook Ave,2,1,1,0.00011062853171393727,0.0037992698142634337
7006,Don Mills Rd at Chipping Rd,2,1,1,8.59169013851871e-05,0.0004104636324968099
7007,Victoria Park Ave at Gerrard St East North Side,2,1,1,0.00012521640215170992,0.00014036580178647385
7008,Horner Ave at Edilou Dr,3,2,1,0.00013330215344857892,0.001036615624556926
7010,Upper Canada Dr at Fairmeadow Ave,2,1,1,0.00011062853171393727,0.0008209272649936198
7011,Hoskin Ave at Tower Rd - Trinity College,2,1,1,8.649839868648732e-05,0.008041557426581717
7012,Gerrard St East at Jones Ave,2,1,1,0.00010804878890493679,0.0016439053290393144
7013,Annette St at Keele St,2,1,1,9.607965567055106e-05,0.011109811427761239
7014,Warden Ave at McNabb St,2,1,1,7.940547617355087e-05,0.0033863249680986815
7015,Marine Parade Dr Loop at Lake Shore Blvd West,2,1,1,0.00011658919481865617,0.003503941478966692
7017,Kennedy Rd at Dancy Ave,2,1,1,0.00010264396745124726,0.0061755635899617195
7018,Mortimer Ave at Inwood Ave West Side,2,1,1,0.00010823945963949546,0.005566248404934071
7019,Kipling Ave at The Kingsway,2,1,1,0.00010297076718554054,0.0
7020,Kingston Rd at Beech Ave,2,1,1,0.00011929338145044659,0.0012797745640153128
7021,Dufferin St at Glengrove Ave,2,1,1,0.0001116882883964901,0.0
7023,Eglinton Ave West at Caledonia Rd,4,2,2,0.00017872794488481904,0.028548821850483797
7024,Midland Ave at Ellesmere Rd,2,1,1,0.00011062853171393727,0.0013717566992769035
7026,Wilson Ave at Bathurst St,2,1,1,0.00013621580357277643,0.0
7027,Lansdowne Ave at Dundas St West,2,1,1,0.00011062853171393727,0.008100276478094429
7028,Gary Dr at Lockerbie Ave West Side,2,1,1,7.651278973327381e-05,0.0005130795406210123
7029,Glencairn Ave at Dufferin St,2,1,1,0.00011062853171393727,0.007145294997804568
7030,Finch Ave East at Sandhurst Cir (West),2,1,1,8.717652257896812e-05,0.0
7032,Finch Ave West at Ardwick Blvd (East),2,1,1,8.541597507140197e-05,0.0051052433361690065
7033,Scarlett Rd at Fontenay Crt South Side,2,1,1,0.00010429644859752076,0.002860481677687122
7034,Steeles Ave East at Kelvin Grove Ave,2,1,1,0.00011325322599864803,0.0
7035,Finch Ave West at John Garland Blvd,2,1,1,9.203276486231238e-05,0.0019511242004122006
7036,Bloor St West at Parkside Dr,2,1,1,8.829362329709604e-05,0.01359027374754296
7038,Rogers Rd at Gilbert Ave,2,1,1,7.697482307529371e-05,0.009243128408968744
7039,Spadina Ave at College St South Side,2,1,1,0.00011062853171393727,0.005475591483576966
7040,Mt Pleasant Rd at Dinnick Cres,2,1,1,8.967843160278231e-05,0.0021549340706082517
7041,Bathurst St at Raeburn Ave,2,1,1,0.00011821938830363079,0.009880321719964426
7042,Sheppard Ave East at Bessarion Rd East Side - Bessarion Stat,2,1,1,0.00010763048696973797,0.012220058488760639
7043,Lawrence Ave West at Bathurst St,4,2,2,0.00011667813653993197,0.014553073818367684
7044,Yonge St at Grosvenor St,2,1,1,0.00010696412385223739,0.005919808580608017
7045,Sherbourne St at Adelaide St East North Side,2,1,1,0.00010619289730579744,0.003283709059974479
7046,Bloor St West at Martin Grove Rd,2,1,1,0.00010614526492312845,0.0029769561505576378
7047,Victoria Park Ave at Hare Gate,3,2,1,0.00014399977805289792,0.004238783326060017
7048,Royal York Rd at Bloor St West South Side,2,1,1,0.00013108902817957242,0.006533673614064937
7049,Kipling Ave at Penlea Ave South Side,2,1,1,8.256149591445895e-05,0.0009610245338369067
7050,Keele St at Annette St,2,1,1,0.0001624600487366764,0.0047373458102934925
7051,Sandra Rd at St Clair Ave East,2,1,1,4.772924490927977e-05,0.002135278742058973
7052,Faywood Blvd at Clanton Park Rd,2,1,1,9.544108401036397e-05,0.007106550404083369
7053,Symington Ave at Paton Rd,2,1,1,0.0001176760201331202,0.020667792855929325
7055,Wilmington Ave at Searle Ave,2,1,1,7.281420830972395e-05,0.0029833049766057
7056,235 Carlaw Ave,2,1,1,0.00010671930449471321,0.007403095486676942
7057,East Ave at Kirkdene Dr,2,1,1,0.00010042071204779119,0.00030731603572947686
7058,Weston Rd at Ray Ave,5,2,3,0.00015157398116987143,0.015293506589197562
7059,Dufferin St at Bloor St West - Dufferin Station,3,1,2,0.00012229439411261584,0.024546397489372814
7060,Hollinger Rd at Waterman Ave,2,1,1,0.00010399490734793596,0.003134558807490539
7061,Steeles Ave East at Laureleaf Rd,2,1,1,0.00011137365408178183,0.00010261590812420247
7062,Danforth Ave at East Lynn Ave,2,1,1,0.00010699998446182251,0.009126210650212097
7063,Ellesmere Rd at Crocus Dr,2,1,1,0.00010452557920734152,0.00010261590812420247
7064,Cosburn Ave at Gledhill Ave,3,1,2,0.00010789389541784579,0.0027706295193534666
7065,Ossington Ave at Argyle St,2,1,1,0.0001181176557491679,0.01522766565108773
7066,Driftwood Ave at Yewtree Blvd,2,1,1,9.882379128071052e-05,0.0008071033602722246
7067,Sheppard Ave West at Yukon Lane,5,1,4,0.00021904368562929917,0.008298324355310254
7071,Driftwood Ave at Finch Ave West,2,1,1,0.00010284016523441286,0.0008209272649936198
7072,Wilmington Ave at Purdon Dr,2,1,1,3.761276505509261e-05,0.00339376860910251
7073,Albion Rd at Westmore Dr,2,1,1,0.00010763614172130202,0.0028727137388345385
7074,Avenue Rd at Lawrence Ave West South Side,2,1,1,0.00011062853171393727,0.0008209272649936198
7075,York Mills Rd at Silverdale Cres,2,1,1,9.268022081255077e-05,7.603147596767333e-05
7076,McCowan Rd at Lawrence Ave East Scarborough General Hospital,2,1,1,0.00010984546154921984,0.0008209272649936198
7078,Opposite 35 Oak St,2,1,1,9.550390178174437e-05,0.0
7079,Lake Shore Blvd West at Seventh St,2,1,1,0.00011042394614998023,0.0034030854300952135
7080,Runnymede Rd at St Clair Ave West,2,1,1,9.110059564259939e-05,0.0018470863462356445
7081,Gerrard St East at Rathmore Ave,2,1,1,8.693984122035468e-05,0.0027292109740535944
7082,Wilson Ave at Northgate Dr,2,1,1,0.00016346849216624553,5.3168864313058275e-05
