stop_id,name,degree,in_degree,out_degree,pagerank,betweenness
9240,Islington Ave at Bywood Dr,2,1,1,0.00011024545678196094,0.0003078477243726074
9241,Lansdowne Ave at Rideau Ave,2,1,1,0.00011062853171393727,0.007176733304976606
9242,Weston Rd at Cardell Ave,2,1,1,0.00012144117823170583,0.0
9244,Morningview Trail at Rangeley Dr,2,1,1,6.473862282890808e-05,0.002066709201758117
9245,1300 Ellesmere Rd,2,1,1,8.823445691904188e-05,0.00020523181624840494
9246,Martin Grove Rd at Eglinton Ave West,2,1,1,0.00010550305815943851,0.0007805189281156956
9247,St Clair Ave West at Dunvegan Rd West Side,2,1,1,0.00011561678402895035,0.0
9248,110 Morningview Trail,2,1,1,7.183207674270151e-05,0.0019640932936339146
9249,Ossington Ave at Leeds St,3,2,1,0.0001510873860969914,0.014436718762444808
9250,Wilson Heights Blvd at Brighton Ave,2,1,1,6.874806331997265e-05,0.0064535471018070814
9251,Lawrence Ave East at Midland Ave West Side,3,2,1,9.366844571759067e-05,0.005215733632534086
9252,Royal York Rd at York View Dr,2,1,1,0.00010994293722525273,0.010554303133418404
9253,Rossdean Dr at Steeles Ave West South Side,2,1,1,8.13506850025373e-05,0.001025627392598894
9254,Victoria Park Ave at Steeles Ave East,3,2,1,0.00011952998642887614,0.008279865768181911
9255,Sheppard Ave East at Grand River Blvd South Side,2,1,1,9.605578002060437e-05,0.001334006805614632
9257,Laird Dr at Lea Ave,2,1,1,0.00011242367263036951,0.014953067898357148
9258,Weston Rd at Ormont Dr,4,2,2,0.00011562734473625946,0.013383567470811797
9259,McNicoll Ave at Harold Evans Cres,2,1,1,0.00010990351861983193,0.011737912944846166
9260,Wellesley St West at Queen's Park Cres East,2,1,1,7.974012319476e-05,0.0035078483666072372
9261,Midland Ave at Finch Ave East,2,1,1,8.484495738299226e-05,0.0029109953211399406
9263,The East Mall at Burnhamthorpe Rd South Side,4,3,1,0.00013967463391139793,0.012066108006797813
9264,Anglesey Blvd at The Kingsway,2,1,1,5.4043052174715744e-05,0.0013504891535516801
9266,Davenport Rd at Caledonia Park Rd,2,1,1,8.922678460168538e-05,0.012196026911685854
9267,Victoria Park Ave at Stamford Sq,2,1,1,0.00011772578997805739,0.0005130795406210123
9269,Huntingwood Rd at Ridgecrest Dr,2,1,1,0.00011062853171393727,0.005157291223592797
9270,Lawrence Ave at Yonge St - Lawrence Station,4,1,3,0.0001305129565564516,0.009154901559343816
9271,Keele St at Humberside Ave,2,1,1,0.00016811621785073878,0.0006156954487452148
9272,McCowan Rd at Castlemore Ave,2,1,1,0.00011062853171393727,0.0032767971076137813
9273,Birchmount Rd at Flora Dr,2,1,1,0.00011062853171393727,0.01060031192400397
9274,Burnhamthorpe Rd at Dundas St West North Side,2,1,1,0.00011037728795037038,0.0031800297745640154
9275,Finchdene Sq (East) at Finchdene Sq (South),2,1,1,0.00010206059184718103,0.00022862611654615058
9276,Sutherland Dr at Bayview Ave East Side,2,1,1,8.787599547503572e-05,0.0152966751972514
9278,Weston Rd at Dennis Ave,3,2,1,0.00018210006881146738,0.0013033716035509332
9279,Sheppard Ave East at Parkway Forest Dr West Side,6,1,5,0.0001418094384932751,0.019911952254131598
9280,Ameer Ave at Ranee Ave,2,1,1,0.00011062853171393727,0.0004104636324968099
9281,Kingston Rd at Pine Ridge Dr,2,1,1,0.0001301363681423763,0.00020523181624840494
9282,The Westway at Fulford Pl,2,1,1,0.00011380954283800635,0.006810718843045514
9283,Bayview Ave at Garnier Crt,2,1,1,0.00011062853171393727,0.0016374617690547081
9284,Eglinton Ave East at Credit Union Dr,2,1,1,9.080570664610793e-05,0.016100831328931357
9285,St Clair Ave East at Victoria Park Ave East Side,2,1,1,6.970742635803434e-05,0.009426520629519352
9286,Meadowvale Rd at Sheppard Ave East,3,1,2,0.00010176610992488862,0.000704310222600312
9287,Caledonia Rd at Kitchener Ave,2,1,1,0.00011048279391903006,0.005516269672479796
9288,Albion Rd at Islington Ave,2,1,1,0.00011062853171393727,0.00010208421948107189
9289,Steeles Ave West at Dufferin St,4,2,2,0.00013095593726815573,0.009241765946861519
9291,St Clair Ave East at Brimley Rd,4,2,2,0.00011802640381354965,0.019430486214421245
9292,Warden Ave at Major Mackenzie Dr East,2,1,1,0.00011062853171393727,0.0021549340706082517
9293,St Clair Ave East at North Woodrow Blvd,2,1,1,0.00018072461916041172,0.0018423809017439389
9294,Coxwell Ave at Dundas St East,2,1,1,0.0001110109942154543,0.004024617184176946
9295,International Blvd at Carlingview Dr East Side,2,1,1,8.624379356641119e-05,0.0008209272649936198
9296,Lawrence Ave East at Port Union Rd West Side,2,1,1,9.88314081627943e-05,0.0018118176662413157
9299,Crow Trail at McGinty Pl,2,1,1,8.494213652985132e-05,0.00041395807333174413
9300,Airport Rd at American Dr North Side,2,1,1,7.0844948184629e-05,0.0033826031475967674
9301,Airport Rd at Northwest Dr,2,1,1,0.00015760349865571134,0.005043066780093577
9302,Evans Ave at North Carson St,2,1,1,6.937608735378932e-05,0.003654409910469418
9303,Lawrence Ave East at Markham Rd,3,1,2,0.00018050006856942555,0.004998088337651289
9304,St Clair Ave East at Squires Ave,2,1,1,0.0001582020121200369,0.013628278746632638
9305,Martin Grove Rd at Rexdale Blvd,2,1,1,0.00010386684176315504,0.00041471714164185454
9306,Sloane Ave at Eglinton Ave East North Side,2,1,1,0.00010278712090836954,0.011621464270523183
9308,Pharmacy Ave at Surrey Ave,2,1,1,0.00011062853171393727,0.009873989791578053
9309,King St West at Spencer Ave,2,1,1,6.403835340007632e-05,0.0021702826038746924
9310,Annette St at Dundas St West,2,1,1,0.00010036665793808664,0.010904579611512833
9312,Finch Ave East at Midland Ave,4,2,2,0.00014749725483739664,0.01451636415856289
9313,Mt Pleasant Rd at Soudan Ave,3,1,2,0.00010420536331305063,0.0023436442952340444
9314,Kodiak Cres at Whitehorse Rd,2,1,1,4.9469892817115815e-05,0.001876772295477102
9316,Sheppard Ave East at Provost Dr East Side,2,1,1,0.00010850120346473502,0.0120757370463873
9318,Vaughan Rd at Winona Dr East Side,2,1,1,9.674273467094073e-05,0.006724796322350547
9319,Finch Ave East at Gaspe Rd,2,1,1,0.00010241622227201311,0.0
9320,Sheppard Ave East at Markham Rd West Side,5,3,2,0.00013883851546929758,0.0028043533278007972
9321,Brimley Rd at Lawrence Ave East,2,1,1,9.06748431542155e-05,0.0007183113568694173
9322,Jane St at Bloor St West North Side,4,2,2,2.8712566389742214e-05,0.03689751974064502
9323,Warden Ave at Boem Ave,2,1,1,0.00010886866395169243,0.0004104636324968099
9324,Kennedy Rd at Bertrand Ave,2,1,1,0.0001219504311664099,0.005001063377286262
9326,Birchmount Rd at Modern Rd,2,1,1,0.00010394099462361739,0.010841131433432582
9327,Bayview Ave at Bayview Mews Lane,2,1,1,0.00010221378149045395,0.0029714685746693404
9328,Eglinton Ave East at Wynford Dr,2,1,1,8.657477575313709e-05,0.01620344723705556
9329,Bathurst St at Olive Ave,3,1,2,0.00010616355728197626,0.005461282391950192
9330,Finch Ave East at Brimley Rd,4,2,2,0.000144858510435214,0.014311132342314485
9331,Islington Ave at Ambleside Ave,2,1,1,0.00016236843023554172,0.015396196653906138
9332,Bannatyne Dr at Silvergrove Rd,2,1,1,8.372641448707252e-05,0.0012313908974904296
9333,Weston Rd at Verobeach Blvd,2,1,1,0.000120172523669031,0.0019815307822405866
9334,Atkinson Ave at Campbell Ave,2,1,1,0.00011062853171393727,0.0010213738834538495
9335,Humber College Blvd at Highway 27 West Side,7,3,4,0.00038740155564398113,0.1351201674527374
9336,Yonge St at College St - College Station,2,1,1,0.0001075151282940304,0.005817192672483814
9337,Bayview Ave at Heathcote Ave,2,1,1,0.00011062853171393727,0.006207199064227988
9338,Ellesmere Rd at Claudius Gate,2,1,1,0.000114283649055101,0.00010261590812420247
9339,Sheppard Ave East at Meadowvale Rd East Side,3,2,1,8.676085099312193e-05,0.0016418545299872395
9340,Finch Ave East at Page Ave,2,1,1,0.00010269663911847426,0.0003078477243726074
9341,Brimley Rd at McNicoll Ave,2,1,1,7.518699131775336e-05,0.0
9342,Donlands Ave at Plains Rd,2,1,1,0.00011312763963796705,0.005207892100810008
9343,Keele St at Falstaff Ave South Side,4,2,2,0.00011408921825321899,0.007583614699759454
9344,Spadina Ave at Sussex Ave,2,1,1,0.0001120369418759369,0.001221820501914079
9345,Island Rd at Port Union Rd,3,1,2,0.0001050443985793157,0.0
9346,Dixon Rd at Riverview Heights West Side,2,1,1,6.883263946553695e-05,0.00010261590812420247
9347,Marlee Ave at Glencairn Ave,2,1,1,9.30138909117786e-05,0.0006592939174819226
9348,Denton Ave at Macey Ave,2,1,1,0.00011062853171393727,0.0076378066311343145
9349,St Clair Ave East at Birchmount Rd East Side,4,2,2,0.00021043049981890054,0.025219030400987545
9350,Park St at Kennedy Rd,2,1,1,0.00010286384653231356,0.001118419720078589
9351,Coxwell Ave at Robbins Ave,2,1,1,8.850915518705379e-05,0.0025085070182900896
9352,Wilson Ave at Dufferin St,10,2,8,0.0002153234565125489,0.1254282278701194
9353,Rangoon Rd at Hagersville Crt,2,1,1,0.00011254626125776045,0.0020459378987664825
9354,Lawrence Ave East at Brimley Rd West Side,2,1,1,0.00012785523663064798,0.00010261590812420247
9355,Cherry St at Unwin Ave,2,1,1,7.098609067474728e-05,0.00041914788033460944
9356,Islington Ave at Great Oak Dr,2,1,1,0.00011023701334903337,0.0004104636324968099
9358,Sherbourne St at King St East,2,1,1,0.00011062853171393727,0.0006156954487452148
9359,Bay St at Dundas St West,2,1,1,0.00010064219177043616,0.0023639081569217677
9360,Kingston Rd at Glen Everest Rd,2,1,1,5.949529132645477e-05,0.0015521561240404286
9361,Sheppard Ave East at Birchmount Rd,3,1,2,0.0001314298539979589,0.022699938317954364
9363,College St at Queens Park (Queen's Park Station),2,1,1,0.00010555825732748534,0.006473192375468003
9364,Evans Ave at Sheldon Ave,3,1,2,9.092605762652751e-05,0.004979112164829265
9365,Finch Ave East at Warden Ave,4,2,2,0.00014789613865582546,0.015439907331680713
9366,Islington Ave at New Toronto St South Side,2,1,1,6.714921210752283e-05,0.0032655430313341845
9367,Bathurst St at Bloor St West,4,1,3,2.158073142911375e-05,0.001920164794739444
9368,Underhill Dr at Kellythorne Dr,2,1,1,0.00012007045549267448,0.02701379644387938
9369,Finch Ave West at Keele St,2,1,1,2.386045795261697e-05,0.005548250508991046
9370,Bay St at Bloor St West - Bay Station,2,1,1,9.348094855905409e-05,0.009295831561037856
9371,Old Weston Rd at Rockwell Ave,2,1,1,0.00014798014149419242,0.0045010127750116456
9372,Arrow Rd at Lido Rd South Side,2,1,1,0.00011575870931516778,0.00539609327000331
9374,1816 Lake Shore Blvd East,3,1,2,0.00011062853171393727,0.00020523181624840494
9375,Belfield Rd at Kipling Ave West Side - Etobicoke North GO St,2,1,1,2.675978260656084e-05,0.0018157198535841757
9376,Lawrence Ave West at Roxaline St,3,1,2,6.220222781202383e-05,0.011138030023464413
9377,Grenoble Dr at Spanbridge Rd,2,1,1,0.00010777899440614347,0.0023614951084644834
9378,Penworth Rd at Crosland Dr,2,1,1,0.00011062853171393727,0.0018327307528711188
9379,Neilson Rd at McLevin Ave,2,1,1,8.835929673706532e-05,0.004620285694030908
9380,Birchmount Rd at Crouse Rd,2,1,1,0.00011062853171393727,0.010497696015879767
9382,Eglinton Ave East at Birchmount Rd,2,1,1,7.809564874683528e-05,0.016694333172852953
9383,Warden Ave at 16Th Ave,2,1,1,0.00011062853171393727,0.0012313908974904296
9384,Midland Ave at McNicoll Ave,2,1,1,6.138716135439365e-05,0.0033214589536367505
9385,Kennedy Rd at Craiglee Dr,2,1,1,9.426265209195721e-05,0.0017019353466609954
9386,Weston Rd at Steeles Ave West,3,2,1,0.00010904038441095595,0.007396726764729282
9387,St Clair Ave East at Kingston Rd,6,2,4,0.00015594486699746388,0.022146134064373647
9388,Main St Markham North at Princess St,2,1,1,0.00011062853171393727,0.005435452998723948
9389,Mortimer Ave at Woodbine Ave West Side,2,1,1,0.00010995904880842493,0.006387175669927691
9390,Steeles Ave West at Kipling Ave,2,1,1,0.00011119864634712322,0.0007601416397996945
9391,Bathurst St at Briar Hill Ave,3,2,1,0.0001936313803563232,0.006814584661777346
9392,Lawrence Ave East at Mossbank Dr West Side,2,1,1,0.00012181195920215744,0.0
9394,Finch Ave West at Dufferin St,4,2,2,0.00012479608743883622,0.008420604960401855
9395,Avenue Rd at Heath St West,2,1,1,9.606114244480605e-05,0.0034214164185453
9396,Greenwood Ave at Queen St East,2,1,1,0.00011062853171393727,0.00027913653764355596
9397,Dawes Rd at Beth St,2,1,1,9.604409797548926e-05,0.0036886785764922727
9398,Opposite 350 Steeles Ave West,2,1,1,9.961066070243284e-05,0.0
9399,Dundas St East at Parliament St,2,1,1,0.00011062853171393727,0.008244009219312282
9401,Elmhurst Dr at Drumheller Rd South Side,2,1,1,0.00012023471087089659,1.4993619736282432e-05
9403,Sheppard Ave East at Twyn Rivers Dr North Side,3,1,2,0.0001054310603950693,0.001563038018269834
9404,Carlton St at Jarvis St,2,1,1,0.00011062853171393727,0.008565280394023482
9405,Birchmount Rd at Rolark Dr,2,1,1,0.00011062853171393727,0.00991758826031476
9406,Sheppard Ave West at Faywood Blvd,4,2,2,0.00016118507602765978,0.01987236919283455
9408,Signet Dr at Steeles Ave West,2,1,1,7.617181134518002e-05,0.0011282433007230965
9410,Reddins Rd at Crosland Dr,2,1,1,0.00011062853171393727,0.001935346660995321
9411,Mortimer Ave at Glebemount Ave,2,1,1,0.0001023433826095124,0.0026784417199134346
9413,Jane St at St Clair Ave West North Side,2,1,1,9.287637428650767e-05,0.00010261590812420247
9414,Ellesmere Rd at Military Trail (West),4,3,1,0.00022940577837858616,0.017200694739827025
9415,Wilson Ave at Wendell Ave,2,1,1,0.00010896226095705942,0.00010261590812420247
9416,Yorkland Blvd (North) at Consumers Rd,2,1,1,9.259532336821456e-05,0.00238457522910947
9417,Ossington Ave at Dewson St,2,1,1,0.00010918552556279717,0.007322958018125961
9419,Jane St at Troutbrooke Dr,3,2,1,0.00017961094448946604,0.000550138239047214
9420,The East Mall at Valhalla Inn Rd North Side,2,1,1,8.776458009919423e-05,0.0035293492131008076
9421,Middlefield Rd at Finch Ave East,2,1,1,7.4205021017655e-05,0.00863072451439104
9422,Kingston Rd at Birchmount Rd East Side,2,1,1,6.0629400024488535e-05,0.0004104636324968099
9423,Queen's Plate Dr at Highway 27,2,1,1,0.00010428162129027648,0.005063802637175671
9424,Dupont St at Ossington Ave,2,1,1,0.00011062853171393727,0.009878420530270809
9426,Avenue Rd at Balmoral Ave,2,1,1,9.817680962297666e-05,0.003216184602296895
9427,Driftwood Ave at Cobbler Cres (South),2,1,1,9.793564899528761e-05,0.001334006805614632
9428,Spadina Rd at Hawarden Cres North Side,2,1,1,7.7615129945065e-05,0.002567137221543801
9429,Princess Margaret Blvd at Cramond Crt,2,1,1,0.0001009525971529568,0.0011909825606125054
9430,Dufferin St at Gordon St,2,1,1,9.2005231274419e-05,0.00010261590812420247
9431,Gerrard St East  at Golfview Ave,2,1,1,0.00010346225809140938,0.003825122541572988
9432,Milner Ave at Cinemart Dr,2,1,1,0.00011062853171393727,0.0009235431731178222
9433,Rogers Rd at Northcliffe Blvd,2,1,1,9.791839911878561e-05,0.008627432960223528
9434,73 Fifeshire Rd,2,1,1,0.0001029566009254314,0.001949702254359847
9435,McCowan Rd at Cree Ave,2,1,1,6.44731688510655e-05,0.0005837941301573799
9436,Kingston Rd at Columbine Ave,2,1,1,0.00011340592126386678,0.0005614632071458954
9437,Dundas St West at Prince Edward Dr North,2,1,1,7.477418346660904e-05,0.00836091025095704
9439,Cosburn Ave at Coxwell Ave,3,1,2,9.61256379441703e-05,0.005934784590144013
9440,Dufferin St at Briar Hill Ave,2,1,1,0.00010699973421976646,0.0
9441,Islington Ave at Evans Ave South Side,2,1,1,0.00010677071489469553,0.005051591521338437
9442,Pape Ave at Danforth Ave,2,1,1,0.00010833975817814233,0.006684784129807524
9443,Fisherville Rd at Bathurst St West Side,2,1,1,8.27134944133285e-05,0.00010261590812420247
9444,Main St Markham North at Parkway Ave,2,1,1,9.964406764784541e-05,0.008206082518077414
9445,Mt Pleasant Rd at Lawrence Cres,2,1,1,9.09440117146828e-05,0.0020523181624840492
9446,East Ave at Island Rd,2,1,1,0.00010196230794376018,0.00020470012760527437
9449,Prince Edward Dr South at Edwalter Ave,2,1,1,0.0001701110419810541,0.023669914144058127
9450,Bloor St West at Eagle Rd East Side,2,1,1,0.0001232962894081821,0.036182711476249456
9451,Sheppard Ave West at Chesswood Dr,2,1,1,0.00020707170383506155,0.00022011909825606123
9452,Eglinton Ave West at Lloyd Manor Rd,2,1,1,0.00012895239651368822,0.0009240748617609528
9453,Yonge St at Glenforest Rd North Side,3,1,2,0.00010662558445977127,0.023728833841056524
9454,Dundas St West at Spadina Ave,2,1,1,0.00011012955971767381,0.004633843332455626
9455,Burnhamthorpe Rd at Holloway Rd,2,1,1,0.00011062853171393727,0.00010259720550861496
9456,Lawrence Ave East at Goldberry Sq,2,1,1,0.00010576548885884581,0.001401354033744506
9457,Meadowvale Rd at Sheppard Ave East North Side,4,3,1,9.560111795419495e-05,0.000998473294039011
9459,Warden Ave at Bridletowne Cir (North),2,1,1,0.00011625867184992603,0.00010261590812420247
9460,Coxwell Ave at Danforth Ave,3,2,1,0.00010822340676919896,0.0047429285410463635
9461,Arleta Ave at Medal Lane,2,1,1,0.00011062853171393727,0.0003078477243726074
9462,Bathurst St at Sheppard Ave West,2,1,1,0.00011380465113951225,0.009367242179343413
9463,Victoria Park Ave at Steeles Ave East South Side,4,2,2,0.00011357317872821398,0.007972018043809304
9464,1450 Sheppard Ave West,3,1,2,0.00014790543177857677,0.0009537608110024102
9465,1515 Albion Rd - Albion Library,2,1,1,0.00011062853171393727,0.0006151637601020842
9466,Kennedy Rd at McNicoll Ave,2,1,1,0.00011062853171393727,0.0005114844746916206
9467,Steeles Ave East at Fairway Heights Dr,2,1,1,0.00011167438969296578,0.0003078477243726074
9468,Bloor St East at Castle Frank Rd,3,1,2,0.00010831166379841173,0.011051185791815306
9469,York Mills Rd at Fenside Dr,4,2,2,0.00015726838185835894,0.0010923543173117823
9470,York Mills Rd at Old York Mills Rd,4,1,3,0.0001964383461602392,0.009307741386643982
9471,20 Norelco Dr,2,1,1,9.98506151528683e-05,0.0004099319438536793
9472,North Queen St at The East Mall East Side,3,2,1,0.00015628198104504889,0.0053498511271799255
9473,Sheppard Ave West at Tuscan Gate,2,1,1,0.0001929931200210395,0.009322586627693374
9474,61 Maybrook Dr,2,1,1,0.00011283930692733031,0.005871526300864882
9475,1859 Kingston Rd,2,1,1,6.868249768260687e-05,0.0003078477243726074
9476,McCowan Rd at Commander Blvd,3,2,1,0.0002139452051547055,0.00949808592088473
9477,Bayview Ave at York Rd South Side,2,1,1,0.00011062853171393727,0.0058993513398553805
9478,849 Broadview Ave,5,4,1,0.00023096050130931592,0.0306998751018583
9479,Keele St at Colville Rd,2,1,1,0.00010805766983775013,0.00020523181624840494
9482,9275 Markham Rd,2,1,1,0.00011062853171393727,0.007795618885580604
9483,Spadina Ave at Queens Quay West North Side,2,1,1,6.630697080977512e-05,0.0
9484,Sheppard Ave West at Goddard St,2,1,1,0.0001281243286534547,0.0
9486,Rathburn Rd at The Wynd,2,1,1,9.210545254596824e-05,0.0006321777966822628
9487,Lawrence Ave West at Ledbury St,2,1,1,0.00012330311762575303,0.00010261590812420247
9488,38 Thorncliffe Park Dr,2,1,1,9.552564546576905e-05,0.004940982560612505
9489,Gateway Blvd at Sunny Glenway (West) West Side,2,1,1,0.00020554937489293223,0.0048240110591237775
9490,The Queensway at Culnan Ave,2,1,1,9.87795901769775e-05,0.004898272077247908
9492,Mabelle Ave at Dundas St West,2,1,1,9.115426437731228e-05,0.004228493324701212
9494,Coxwell Ave at Earl Haig Ave,2,1,1,0.00010827836400678065,0.004640312632922161
9495,Avenue Rd at Brooke Ave,2,1,1,0.00010425233157706438,0.002257549978732454
9497,Dufferin St at Ascot Ave,2,1,1,0.00010145687137268962,0.0
9498,Yonge St at Churchill Ave,2,1,1,7.609674143438154e-05,0.009805512904477362
9499,Royal York Rd at Allanhurst Dr South Side,2,1,1,0.00016311448500009926,0.0044845278604849
9500,Parkette Pl at Birchmount Rd,2,1,1,8.35865546672918e-05,0.002189001596966293
9501,Rogers Rd at Caledonia Rd,2,1,1,8.186756146298814e-05,0.009140512500844541
9502,Albion Rd at Riverdale Dr,2,1,1,0.00011062853171393727,0.0
9503,Glencairn Ave at Capitol Ave,2,1,1,0.00011062853171393727,0.007042679089680365
9504,Lawrence Ave West at Bathurst St West Side,2,1,1,0.00011786823849881803,0.0008394203627083252
9506,McNicoll Ave at Boxdene Ave,2,1,1,0.00011062853171393727,0.00039265206295193534
9507,New Westminster Dr at Beverley Glen Blvd,2,1,1,9.858443566819857e-05,0.0019449170565716716
9508,Humber College at Finch Ave West North Side,2,1,1,3.8155491252344796e-05,0.0022893626825464344
9509,Welland Ave at Heath St East,2,1,1,9.839986033242525e-05,0.003678475218245529
9510,Bayview Ave at Dawlish Ave South Side,3,1,2,0.0001874373943827246,0.007098005408033055
9512,Caledonia Rd at Eglinton Ave West,2,1,1,0.00011929751750642769,0.007997204836847542
9514,Lawrence Ave East at Galloway Rd,4,2,2,0.00013721904627131526,0.0012694952502481213
9516,Dufferin Gate Loop,3,1,2,0.00014727692733747323,0.007776873452649718
9517,Glen Rd at Elm Ave,2,1,1,0.00011062853171393727,0.0018470863462356445
9518,Opposite 60 Belfield Rd East Side,2,1,1,8.884885528265268e-05,0.0011045278229155026
9519,Thirtieth St at Akron Rd,0,0,0,1.6598932385570904e-05,0.0
9520,Neilson Rd at Silverbell Grove South Side,2,1,1,9.796768143537386e-05,0.004312437969658301
9521,Pharmacy Ave at Sherwood Ave South Side,2,1,1,0.00011062853171393727,0.009976605699702254
9522,McCowan Rd at Sandhurst Cir (South),2,1,1,0.000121951801532441,0.005076297320289239
9523,Parliament St at King St East,2,1,1,0.00010185860412644895,0.0009021996718721516
9524,Lawrence Ave West at Shermount Ave East Side,4,2,2,0.00010422685390907023,0.00470810293492131
9525,Sheppard Ave West at Don River Blvd West Side,2,1,1,0.00016595198204890125,0.00020523181624840494
9526,Sheppard Ave West at Tuscan Gate,3,1,2,0.00022191415753598158,0.0026382770249741756
9527,715 Milner Ave,2,1,1,0.00010281379861935526,0.001128774989366227
9528,Brimley Rd at Wenlock Gate,2,1,1,0.00011062853171393727,0.0004104636324968099
9529,Opposite 3200 Pharmacy Ave at Walkway to Deerbrook Trail,2,1,1,9.363770973277202e-05,0.0027706295193534666
9530,Dufferin St at Liberty St,4,2,2,0.00016615532009007199,0.018510329390852308
9531,Bathurst St at Alcina Ave,2,1,1,0.00011156215173054366,0.0011328051482241187
9532,Kipling Ave at Beaverbrook Ave,2,1,1,0.00011109401463646419,0.0
9533,Steeles Ave West at Irondale Dr,2,1,1,0.0001251792717191614,0.00579487863115089
9534,Lawrence Ave West at Glen Rush Blvd,2,1,1,0.00010720924713625223,0.00020523181624840494
9535,Royal York Rd at Norseman St North Side,2,1,1,0.00016713807460549303,0.0045664860536457725
9538,Markham Rd at Brimorton Dr,3,1,2,0.00014507770964327583,0.011678064298879909
9540,Cosburn Ave at Logan Ave,2,1,1,6.40513066361436e-05,0.006755711855137633
9541,The Westway at Martin Grove Rd,2,1,1,0.000102704279224356,0.006460894300297746
9542,Marlee Ave at Dell Park Ave,2,1,1,0.00010409491843556365,0.001219693747341557
9543,Lawrence Ave West at Englemount Ave East Side,3,2,1,0.00010294445190050922,0.0006720544449170566
9544,Rogers Rd at Scott Rd,3,1,2,0.0001268840880636212,0.0139922607917423
9545,Spadina Ave at Willcocks St,2,1,1,0.00011094735346538041,0.001427052318162484
9546,Garnett Janes Rd at Coin St,2,1,1,6.10848405587747e-05,0.00948000850701829
9547,Mortimer Ave at Roosevelt Rd,2,1,1,0.00011032990292639472,0.005874096129306678
9548,Danforth Rd at Hubert Ave,3,2,1,0.00011188032029886436,0.010831169214044853
9549,Dupont St at Howland Ave,2,1,1,0.00011062853171393727,0.009262725081525593
9552,Opposite 601 Milner Ave,2,1,1,0.00011062853171393727,0.00030465759251382393
9554,Rexdale Blvd at Kipling Ave,2,1,1,0.00010603803240098004,0.005660888983411314
9555,Kennedy Rd at Havendale Rd,2,1,1,0.0001007009147724462,0.0015376435559336453
9556,The Queensway at North Queen St,2,1,1,0.0001120703053599348,0.010134302940077078
9557,Lawrence Ave West at Pimlico Rd,2,1,1,0.00012279336454501465,0.0
9558,Arrow Rd at Sheppard Ave West North Side,3,2,1,0.00012825896568740904,0.0037712949357462324
9559,Huntingwood Dr at Commander Blvd,2,1,1,0.00011062853171393727,0.002097405359421523
9560,Bridgeland Ave at Dufferin St West Side,2,1,1,3.991342572408291e-05,0.0007167162909400256
9561,Lawrence Ave East at Paulander Ave,2,1,1,8.550009569294935e-05,0.0022520204168438966
9562,Sheppard Ave East at McCowan Rd,4,2,2,0.00010472092410100596,0.002874270827003707
9563,Bathurst St at Ranee Ave,2,1,1,9.998419358165338e-05,0.0015290882023123622
9564,Warden Ave at Arkona Dr,2,1,1,0.00010956865174119592,0.00010261590812420247
9565,Brimley Rd at Comrie Ter (North),2,1,1,9.045745249271987e-05,0.007925320532296286
9567,Bloor St West at Islington Ave,4,2,2,0.00021474783712313082,0.04044821399797274
9568,2121 Kingston Rd,2,1,1,8.492074235450479e-05,0.0
9569,Wilson Ave at Belgrave Ave West Side,2,1,1,0.00014424598120342218,0.01459504476547815
9570,Sheppard Ave West at Laura Rd East Side,3,2,1,0.00023527738074922687,0.002449906068339714
9571,Rogers Rd at Nairn Ave,2,1,1,8.900743404419614e-05,0.008935280684596135
9572,Rathburn Rd at Lloyd Manor Rd West Side,2,1,1,6.628964970965222e-05,0.002559017439387495
9574,Underhill Dr at Cassandra Blvd (North),2,1,1,8.043575927402623e-05,0.04011561939447552
9575,Finch Ave East at Alexmuir Blvd,2,1,1,0.00011181095664825234,0.0
9576,McNicoll Ave at Cleadon Rd,2,1,1,0.00010934755597429564,0.0008031156954487452
9577,Milner Ave at Progress Ave,2,1,1,0.00011062853171393727,0.004838366652488303
9578,Dixon Rd at Skyway Ave,4,1,3,0.00019644796374379068,0.012251099626161308
9579,Caledonia Rd at Norman Ave,2,1,1,0.00011062853171393727,0.005534878774989366
9580,O'Connor Dr at Sunrise Ave,2,1,1,9.948208869185843e-05,0.007480550682309372
9581,McCowan Rd at Castlemore Ave,2,1,1,0.00011062853171393727,0.001840174393874947
9582,Walsh Ave at Weston Rd,4,2,2,0.00011293773409650433,0.10459834076867017
9583,1710 Midland Ave,2,1,1,0.00011062853171393727,0.0009666580456514815
9584,Lawrence Ave East at Greenland Rd East Side,3,1,2,0.0001000180789157131,0.033124685951766236
9585,O'Connor Dr at Coxwell Ave,2,1,1,8.967048451414847e-05,0.00716330816673756
9586,Weston Rd at Coronado Crt,2,1,1,0.00012454630284161256,0.004737345810293493
9587,Warden Ave at Bridletowne Cir (South),2,1,1,0.0001220871339504841,0.01139565046466365
9588,Sheppard Ave East at Meadowvale Rd,2,1,1,8.578880354757445e-05,0.0011364844746916205
9589,Passmore Ave at Kennedy Rd,2,1,1,9.013605555502374e-05,0.0020523181624840492
